id,severity,remediation_risk,remediation_risk_axis,persona,area,finding,evidence,proposed_action,disposition
D1,medium,low,usability,software-engineer,accuracy,"release-review/MANIFEST.md Files table lists plan-review.md (not in release-review/; it is in the plan-review/ sibling dir) and omits MANIFEST.md + templates/ which are present","ls release-review/plan-review.md -> not found; MANIFEST.md and templates/ present but not in the table","Fix the Files table: remove plan-review.md row; add MANIFEST.md and templates/",proposed
D2,low,low,usability,software-engineer,accuracy/drift,"MANIFEST hand-enumerates assess commands with 'and more' - drifts as lenses are added; index.md is authoritative","release-review/MANIFEST.md lines ~45-47","Replace enumeration with a pointer to index.md",proposed
D3,medium,-,-,complete-novice,completeness,"Plan/IPD lifecycle not in top-level docs","RESOLVED by README rewrite: pipeline diagram + lifecycle mentions (README ~line 94)","none",resolved-before-finalization
D4,low,-,-,software-engineer,navigation,"DECISIONS-as-changelog not stated","RESOLVED by README rewrite (README ~line 166)","none",resolved-before-finalization
D5,low,-,-,complete-novice,getting-started,"Newcomer IPD/pipeline primer missing","RESOLVED by README rewrite (usage section + pipeline block)","none",resolved-before-finalization
